{
  "slice_id": "S1",
  "linear_issue_id": "ISSUE-301",
  "phase": "pass",
  "agent_id": "impl-S1@session-9ce4e753",
  "worktree_path": "worktrees/S1",
  "branch": "slice/S1",
  "base_sha": "ce82169000000000000000000000000000000000",
  "head_sha": "a1b2c3d4e5f6000000000000000000000000000000",
  "round_count": 1,
  "reviewer_verdict": "PASS",
  "report_file": "orchestration/runs/arch-deepening-2026-06/reports/S1.json",
  "verdict_file": "orchestration/runs/arch-deepening-2026-06/reports/S1.review.json",
  "files_changed": ["models.ts", "interfaces.ts", "service.ts", "tests/service.test.ts"],
  "last_defects": [],
  "ac_evidence": ["AC1: test_challenge_status_enum PASS", "AC2: test_canary_noop_default PASS"],
  "gate_result": "pass",
  "boundary_ok": true,
  "ship_pr": null,
  "merge_sha": null,
  "escalation": null,
  "updated_at": "2026-06-17T12:05:00Z"
}
